{
  "specversion": "1.0",
  "id": "22222222-2222-4222-8222-222222222222",
  "source": "urn:planeon:harness:control.web",
  "type": "harness.operation.state.changed.v1",
  "subject": "operation.compile-001",
  "time": "2026-08-31T05:00:01Z",
  "datacontenttype": "application/json",
  "dataschema": "https://harness.planeon.ai/schemas/v1alpha1/events/harness-cloud-event.schema.json",
  "organizationid": "org.acme",
  "partitionkey": "org.acme",
  "sequence": 2,
  "data": {
    "schemaVersion": "harness.planeon.ai/event-data/v1alpha1",
    "aggregateKind": "Operation",
    "aggregateId": "operation.compile-001",
    "aggregateVersion": 2,
    "actor": {"type": "WORKLOAD", "id": "workload.profile-compiler"},
    "correlationId": "aaaaaaaa-aaaa-4aaa-8aaa-aaaaaaaaaaaa",
    "causationId": "11111111-1111-4111-8111-111111111111",
    "reasonCode": "WORK_COMPLETED",
    "transition": {"from": "RUNNING", "to": "SUCCEEDED"},
    "resourceRefs": [{"kind": "resource.profile", "id": "profile.foundation-001", "digest": "sha256:aaaaaaaaaaaaaaaaaaaaaaaaaaaaaaaaaaaaaaaaaaaaaaaaaaaaaaaaaaaaaaaa"}],
    "evidenceRefs": [{"kind": "resource.evidence", "id": "evidence.compiler-001", "digest": "sha256:bbbbbbbbbbbbbbbbbbbbbbbbbbbbbbbbbbbbbbbbbbbbbbbbbbbbbbbbbbbbbbbb"}]
  }
}
